"title","clientSpent","estimatedBudget","paymentVerified","techStack","matchesInDescription","keyword","link","jobDescription"
"Microservices & DevOps Expert","$400K+
spent","Hourly: $25.00 - $40.00 Expert Est. time: More than 6 months, 30+ hrs/week","Yes","Amazon Web Services, Terraform, Kubernetes, Apache Kafka, DevOps","No","aws lambda","https://www.upwork.com/jobs/Microservices-DevOps-Expert_~021922713348650342829/?referrer_url_path=/nx/search/jobs/","We are looking for 1 or more engineers with the below experience. If you feel you are a good fit, please send us a note explaining the most comprehensive and impressive project that you have worked on. Sending a AI generated response is a waste of your time and mine, if you have not worked on a similar project. We can work out your experiece in about 30 seconds :) Please be also prepared to present yourself at an interview via video confierence with VIDEO ON. 1. Terraform (Infrastructure as Code) Expertise 2. Kubernetes Deployment and Management 3. Ingress Controller Configuration (ALB and NGINX) 4. Jenkins Setup and Configuration 5. Jenkins Pipeline Scripting (Bash, Python, Groovy) 6. AWS API Gateway Configuration and Management 7. AWS CloudFront and WAF (Web Application Firewall) – Policies and Rules Management 8. S3 Configuration – Permissions, Access Policies, and Bucket Policies 9. COMF Knowledge 10. Frontend Build and Deployment knowledge (Node.js and React.js Applications) 11. Database Management - PostgreSQL, database design, ORM tools 12. Real-time Communication using Socket.IO: 13. Message Queues / Event-driven Architecture, Apache Kafka: If you feel you have the above experience, please send your details. In your response, kindly detail your experience in relation to the above. Thank you. Rana Peries"
"NestJS Backend/Full Stack Dev Needed for Multiple Projects","$400K+
spent","Hourly: $20.00 - $35.00 Expert Est. time: More than 6 months, Hours to be determined","Yes","Amazon Web Services, PostgreSQL, RESTful API, DevOps, NestJS, React Native","No","aws lambda","https://www.upwork.com/jobs/NestJS-Backend-Full-Stack-Dev-Needed-for-Multiple-Projects_~021924233533173038594/?referrer_url_path=/nx/search/jobs/","We have a large EdTech platform built on a NestJS backend and hosted on AWS using ECS. The backend stack: NestJS PostgreSQL (Aurora) RDS Redis Polly We use React on the frontend served through CloudFront. We use a variety of third party SSO partners and APIs, including Clever, ClassLink, Desmos, etc. Our immediate need is to address bugs in our beta release for the upcoming school year and to work with DevOps to migrate to ECS. We have a DevOps engineer on the team, but you are required to understand the GitLab pipelines, runners, and AWS infrastructure in our CI/CD implementation. Even better if you have some understanding of Terraform/HCL. We are also working on another project outside of EdTech that is part of a startup release that will go to market this fall. So, we're looking for a longterm relationship. Must be a strong communicator and write well structured, fully documented code. We deliver performant, secure, reliable, and scalable applications--quality is of the utmost importance in our work. If you're also fluent in React or React Native, you are well positioned for this opportunity. We are a small team that uses ClickUp for PM and chat. We hold each other accountable in our pursuit of building first class solutions. Manual time is disabled for the first few months. There are budget constraints in the short term that we'll discuss during our initial call, but this will be a longterm relationship building and supporting a variety of experiences we provide for both clients and self-funded ventures. No agencies. If you reach out to me outside of Upwork, you will be discarded. Thank you for your time."
"Tech Lead / Head of Engineering for Marketing Technology Platform","$400K+
spent","Hourly Expert Est. time: 1 to 3 months, 30+ hrs/week","Yes","Web Development, Tech & IT, Project Management, SaaS","No","aws lambda","https://www.upwork.com/jobs/Tech-Lead-Head-Engineering-for-Marketing-Technology-Platform_~021919102366710035906/?referrer_url_path=/nx/search/jobs/","We are a fast-moving digital company evolving from a high-performance marketing operation into a full-fledged tech-driven product organization. We’re building a modular, automation-first platform designed to drastically reduce manual workloads and unlock scalable performance across digital advertising and content workflows. We’re now looking for a high-level, hands-on Tech Lead / Head of Engineering to join us at this critical stage — someone who thrives in fast-paced environments, understands what it takes to go from MVP to scalable architecture, and can lead multiple dev streams in parallel. This is not a one-off gig. We’re looking for someone who wants to grow with the business, ship fast, and help us build a platform that’s efficient, flexible, and ready for broader applications down the line. What You’ll Do: • Lead and scale a focused remote developer team • Guide architectural decisions with an eye on modularity, performance, and maintainability • Collaborate directly with the founders, product manager, and CTO • Turn product ideas into structured development sprints and shipped features • Unblock developers, review code, and help deliver fast, clean MVPs • Integrate and guide use of AI tools for automation (e.g. content generation, smart rules) • Help lay the groundwork for API-first infrastructure usable across future use cases About the Platform (at a glance): We’re building a productized internal toolchain that automates repetitive tasks in digital operations – from asset generation to publishing and performance-based scaling decisions. Long-term, the system will support other industries and business models, not just our own. Flexibility, modularity, and API-first thinking are critical. You Should Have: • 5+ years in backend or fullstack development • Experience leading remote development teams • Strong system architecture and problem-solving skills • DevOps experience (Docker, CI/CD, GCP or AWS) • Familiarity with AI tools (or eager to learn/integrate them efficiently) • Lean, results-driven working style • Solid communication and reliability in distributed setups • Bonus: Experience with platform/API development for internal/external users ⸻ Loom Video Required: We receive a lot of AI-generated proposals. Please send a short Loom video (1–2 minutes) introducing yourself, your experience, and your approach to building modular platforms. Also, please start your proposal with the keyword “YLM” so we know you read the full job post."
"Tech Lead / Head of Engineering for Marketing Technology Platform","$400K+
spent","Hourly Expert Est. time: 1 to 3 months, 30+ hrs/week","Yes","Web Development, Tech & IT, Project Management, SaaS","No","aws lambda","https://www.upwork.com/jobs/Tech-Lead-Head-Engineering-for-Marketing-Technology-Platform_~021919101680475809848/?referrer_url_path=/nx/search/jobs/","We are a fast-moving digital company evolving from a high-performance marketing operation into a full-fledged tech-driven product organization. We’re building a modular, automation-first platform designed to drastically reduce manual workloads and unlock scalable performance across digital advertising and content workflows. We’re now looking for a high-level, hands-on Tech Lead / Head of Engineering to join us at this critical stage — someone who thrives in fast-paced environments, understands what it takes to go from MVP to scalable architecture, and can lead multiple dev streams in parallel. This is not a one-off gig. We’re looking for someone who wants to grow with the business, ship fast, and help us build a platform that’s efficient, flexible, and ready for broader applications down the line. What You’ll Do: • Lead and scale a focused remote developer team • Guide architectural decisions with an eye on modularity, performance, and maintainability • Collaborate directly with the founders, product manager, and CTO • Turn product ideas into structured development sprints and shipped features • Unblock developers, review code, and help deliver fast, clean MVPs • Integrate and guide use of AI tools for automation (e.g. content generation, smart rules) • Help lay the groundwork for API-first infrastructure usable across future use cases About the Platform (at a glance): We’re building a productized internal toolchain that automates repetitive tasks in digital operations – from asset generation to publishing and performance-based scaling decisions. Long-term, the system will support other industries and business models, not just our own. Flexibility, modularity, and API-first thinking are critical. You Should Have: • 5+ years in backend or fullstack development • Experience leading remote development teams • Strong system architecture and problem-solving skills • DevOps experience (Docker, CI/CD, GCP or AWS) • Familiarity with AI tools (or eager to learn/integrate them efficiently) • Lean, results-driven working style • Solid communication and reliability in distributed setups • Bonus: Experience with platform/API development for internal/external users ⸻ Loom Video Required: We receive a lot of AI-generated proposals. Please send a short Loom video (1–2 minutes) introducing yourself, your experience, and your approach to building modular platforms. Also, please start your proposal with the keyword “YLM” so we know you read the full job post."
"DevOps Engineer for Ruby on Rails Applications on AWS","Not listed","Hourly: $35.00 - $75.00 Expert Est. time: 1 to 3 months, 30+ hrs/week","Yes","Amazon Web Services, Amazon ECS, DevOps, Ruby on Rails, Docker","No","aws lambda","https://www.upwork.com/jobs/DevOps-Engineer-for-Ruby-Rails-Applications-span-class-highlight-AWS-span_~021927096449876027945/?referrer_url_path=/nx/search/jobs/","We are seeking an experienced DevOps Engineer to join our team and enhance our Ruby on Rails applications hosted on AWS. The ideal candidate will have a proven track record in managing cloud infrastructure, optimizing application performance, and automating deployment processes. Your responsibilities will include setting up CI/CD pipelines, monitoring system health, and implementing security best practices. If you are passionate about DevOps and have a strong understanding of AWS services, we want to hear from you!"
"Expert Needed to Finalize AWS Bedrock RAG Chat with Medication Guides","$300K+
spent","Hourly: $20.00 - $85.00 Expert Est. time: 1 to 3 months, Less than 30 hrs/week","Yes","Amazon Web Services, Amazon Bedrock, AI Agent Development, AI App Development","No","aws lambda","https://www.upwork.com/jobs/Expert-Needed-Finalize-span-class-highlight-AWS-span-Bedrock-RAG-Chat-with-Medication-Guides_~021924893024190424032/?referrer_url_path=/nx/search/jobs/","We are seeking an AWS expert to assist us in finalizing our RAG chat using AWS Bedrock. Our current setup includes a knowledge base focused on medication guides, and we need to ensure that the integration is seamless, functioning effectively and providing accurate information. Your expertise will help us refine the system, troubleshoot any issues, and optimize the chat functionalities. If you have a strong background in AWS Bedrock and experience with chat systems, we want to hear from you!"
"Replit AI Developer for Vibe Coding Full stack","$5M+
spent","Hourly: $25.00 - $47.00 Expert Est. time: More than 6 months, 30+ hrs/week","Yes","Node.js, API, CSS, Python, HTML, JavaScript, React, WordPress","Yes","node.js","https://www.upwork.com/jobs/Replit-Developer-for-Vibe-Coding-Full-stack_~021925023874875039972/?referrer_url_path=/nx/search/jobs/","Looking for a full stack developer who’s comfortable living in the messy middle of creative, AI-assisted software development—where half-finished projects become real tools, integrations get untangled, and deployment means more than just spinning up a server. These aren’t clean, linear builds. They’re iterative, sometimes chaotic, often AI-generated starting points that need real engineering insight to go the final mile. The core of the job is taking Replit-based projects—partially working, loosely structured—and completing them for real-world usability. What you'll be doing: Taking Replit projects from 50% to shipped: debugging, refactoring, and wiring together loose ends Integrating APIs and services: OpenAI, Pinecone, Notion, Stripe, and others Handling auth, credentials, and environment setup to make APIs work securely and consistently Deploying to live environments: Replit hosting when possible, Vercel/Heroku/custom servers when needed Making practical decisions on structure, packages, and architecture to support fast iteration Working with AI assistance (Replit AI, Copilot, etc.) to speed up build cycles without depending on them blindly Technical context: Most builds lean on modern JavaScript (Node.js, Express, React) and Python (Flask, FastAPI) depending on the use case. There’s a lot of API stitching, utility logic, async workflows, and figuring out what’s broken in a semi-working project scaffold. You should be comfortable picking up unfamiliar code, figuring out what it should do, and getting it there quickly. Who this is for: You like working inside flexible, AI-enabled dev environments like Replit You know how to make AI-generated code functional, not just passable You don’t get stuck in framework wars—React, Flask, vanilla JS, it all depends on the job You think in terms of usability, not just syntax. You care whether it works and makes sense You enjoy deploying small projects that solve real problems, not just writing boilerplate This is ""vibe coding"" with a real finish line—fast, messy, creative, technical, and deployed. Let’s build, fix, and launch some great stuff."
"TypeScript Software Engineer with LLM & AWS Expertise Needed","$4M+
spent","Hourly: $55.00 - $65.00 Expert Est. time: More than 6 months, 30+ hrs/week","Yes","Python, Machine Learning, Amazon Web Services, Artificial Intelligence","No","node.js","https://www.upwork.com/jobs/TypeScript-Software-Engineer-with-LLM-AWS-Expertise-Needed_~021901667430194153563/?referrer_url_path=/nx/search/jobs/","We are seeking an experienced Platform Engineer with a strong background in TypeScript to join our AI Coach Platform team. The ideal candidate will be proficient in TypeScript, experienced with modern AI technologies such as large language models (LLMs) and embedding models, deeply familiar with the NestJS framework, and knowledgeable about AWS cloud services. You will be responsible for designing scalable AI solutions, working with cutting-edge AI technologies, deploying and maintaining platform services, and leveraging AWS features for efficient data processing and storage. If you are passionate about AI and want to help iFIT change our members' lives, we encourage you to reach out! ### ROLE COMMITMENTS - Build and maintain scalable platform services and infrastructure - Collaborate effectively across teams to ensure seamless integration of platform and AI components - Drive technical excellence in engineering practices focused on TypeScript and platform development - Contribute to our engineering culture of ownership and innovation ### ESSENTIAL DUTIES AND RESPONSIBILITIES - Design, develop, and deploy robust platform solutions using TypeScript - Write clean, tested code in TypeScript, following engineering best practices - Contribute to initiatives to enhance platform scalability, reliability, and performance using modern cloud infrastructure (AWS) and Infrastructure as Code (Terraform) - Contribute to platform tooling and infrastructure to support seamless integration of ML capabilities - Participate in code reviews and technical design discussions with a focus on platform enhancement - Monitor and maintain platform services in production, ensuring high availability and performance - Document technical decisions and system architectures related to platform engineering"
"AI Software Engineer - JavaScript / Node.js / Python (German C1, CET ±2h)","Not listed","Hourly: $25.00 - $30.00 Expert Est. time: More than 6 months, 30+ hrs/week","Yes","Node.js, TypeScript, Angular, JavaScript","Yes","node.js","https://www.upwork.com/jobs/Software-Engineer-JavaScript-span-class-highlight-Node-span-Python-German-CET_~021920133185485118513/?referrer_url_path=/nx/search/jobs/","We are looking for a structured and technically-minded AI Software Engineer to support the development of AI-assisted software systems using tools like Cursor and Windsurf. This role is hands-off in terms of coding, but you will take ownership of technical execution, coordinate across teams, and shape efficient, AI-supported development workflows. 32h + per week / full time Requirements Strong understanding of modern software development (JavaScript, Node.js, Python) Experience with or strong interest in AI developer tools like Cursor and Windsurf Ability to manage, structure, and delegate technical work effectively Excellent communication skills and a client-aware, solution-driven mindset Strong team player who values structure, clarity, and shared ownership German language proficiency at C1 level or higher Availability to work during core German business hours (±2h CET, Berlin time) Responsibilities Translate business and technical requirements into clear, structured development plans Leverage AI tools like Cursor and Windsurf to support architecture, code analysis, and documentation Coordinate development tasks across internal teams and external freelancers Collaborate closely with engineers and product stakeholders to ensure high-quality delivery Maintain organized, AI-assisted workflows in a collaborative team environment"
"AI Solution Architect","Not listed","Hourly: $45.00 - $60.00 Expert Est. time: 3 to 6 months, Hours to be determined","Yes","Activity Diagram, Artificial Intelligence, Computer Vision, TypeScript","Yes","node.js","https://www.upwork.com/jobs/Solution-Architect_~021920139037106682284/?referrer_url_path=/nx/search/jobs/","We’re looking for someone who thrives at the intersection of people, process, and technology. As an AI Solution Specialist, you’ll help drive software projects by ensuring that client goals, technical implementation, and AI-supported workflows come together smoothly. Your role focuses on translating complex inputs into structured action, keeping everyone on the same page, and guiding AI-assisted delivery in a way that’s both efficient and human-centric. While not writing code, you’ll be the one who keeps the bigger picture aligned. Whether you’re aligning with developers, supporting decision-making, or keeping freelancers moving in the right direction. 20-32h + per week What you bring A confident, structured way of working – you create clarity where others see complexity Familiarity with how modern software systems are built (JavaScript, Node.js, Python – you understand the architecture, even if you don’t write the code) A sharp eye for spotting gaps, asking the right questions, and connecting dots across roles and disciplines Experience using AI-enhanced tools like Cursor or Windsurf – or a clear interest in leveraging them Strong communication skills, especially in client-facing situations Comfort working across disciplines and leading through coordination, not hierarchy Excellent written and spoken German (C1+) Availability during core German business hours (±2h CET) Your role @elunic Act as a central point of coordination between developers, freelancers, and stakeholders Help define what needs to be done, by whom, and why – turning vague goals into actionable work Support teams in using AI tooling to speed up architecture, documentation, and decisions Keep communication flowing across product, tech, and client interfaces Facilitate productive collaboration by creating structure and eliminating friction Ensure that the technical side of the project stays aligned with real-world needs and constraints"
"Senior Web Scraping Developer in a tech startup","$3M+
spent","Hourly Expert Est. time: 3 to 6 months, Not sure","Yes","Puppeteer, Scrapy, Python, Data Scraping, Selenium, JavaScript","Yes","node.js","https://www.upwork.com/jobs/Senior-Web-Scraping-Developer-tech-startup_~021927463237135717976/?referrer_url_path=/nx/search/jobs/","🌟 About Us We are a fully remote tech startup providing customers with various ethical proxy and scraping solutions. We’re committed to delivering high-performance, scalable products that empower businesses to collect data efficiently, responsibly, and at scale. 🌟 About the Project As we continue to grow, web data extraction remains a key part of our product offering. You'll be responsible for developing and optimizing web scrapers, integrating them into our backend, and ensuring that data collection is efficient, scalable, and adaptable to evolving detection mechanisms. 💡 As a Senior Web Scraping Developer, you will: 🌟 Develop and maintain scalable web scrapers for high-traffic environments. 🌟 Build web automation solutions for collecting publicly available data, including fingerprinting, CAPTCHAs, and rate limiting. 🌟 Optimize and integrate scraping solutions with our backend systems. 🌟 Work with proxy management to improve scraping success rates. 🌟 Enhance the performance and resilience of data extraction pipelines. 🌟 Collaborate with the team to deliver efficient and reliable scraping solutions. 🎯 What We’re Looking For ✅ 3+ years of strong JavaScript experience in browser environments, including skills in building extensions, intercepting events, and advanced DOM manipulation. ✅3+ years of experience with Python for scraping. ✅3+ years of experience with Node.js in backend development. ✅ Experience in web scraping, including working with Puppeteer, Playwright, or similar tools. ✅ Understanding of detection mechanisms such as fingerprinting and rate limiting. ✅ Experience with proxy rotation and session management to improve scraping success rates. ✅ Problem-solving mindset and ability to think outside the box. ✅ English - communicative level (B2) is a must. ✅ You are in the Central European Time (CET) zone or nearby. ✨ Why Join Us? ➡️ Work on cutting-edge and ethical web automation challenges. ➡️ Flexible engagement (full-time or part-time) ➡️ Join a trusted leader in the web data industry. ➡️ Fully remote and international team. 🛠️ Our Tech Stack ⚡️ Python ⚡️ Javascript/TypeScript ⚡️ Node.js ⚡️ Vue.js ⚡️ MySQL/Postgresql ⚡️ Puppeteer/Playwright/Patchwright/Camufox for web scraping If you're passionate about ethical data automation and public data extraction, we’d love to hear from you! 👉 Apply now and share your experience working with automation and data collection technologies!"
