"title","clientSpent","estimatedBudget","paymentVerified","techStack","matchesInDescription","keyword","link","jobDescription"
"ReactJS WebAPI (FullStack Developer)","$2M+
spent","Hourly: $25.00 - $30.00 Expert Est. time: More than 6 months, 30+ hrs/week","Yes",".NET Framework, React, JavaScript, API, API Development","Yes","node.js","https://www.upwork.com/jobs/React-span-class-highlight-span-WebAPI-FullStack-Developer_~021927457521847064153/?referrer_url_path=/nx/search/jobs/","Role: Senior Full Stack (ReactJS + .net C# WebAPI) We are seeking a highly skilled and experienced Full Stack Tech Lead Developer to join our dynamic team. The ideal candidate will have a strong background in software development, with at least 10 years of professional experience, particularly with hands-on coding in ReactJS and .NET C# WebAPI. This role requires an individual who demonstrates excellent technical leadership, a high degree of ownership, and an ability to communicate effectively across all levels of the organization. Key Responsibilities: Led the design and development of high-quality software solutions using ReactJS and .NET C# WebAPI. Proficient in Microsoft Azure services such as Azure SQL, Azure AD, WebApp, ApiApp, Azure Storage, EventHub, Stream Analytics, Application Insights, and others. In-depth knowledge of rest API design, architecture, implementation, and integration. Well-versed in ADODevOps control systems Architected, designed, developed, and maintained applications using .NET MVC, ReactJS, and other relevant technologies. Proficient in .NET languages (C#) and frameworks, enabling the creation and implementation of highly scalable web, mobile, and desktop software applications. Familiarity with Node.js jQuery: jQuery, jQuery UI Well-versed in Kendo UI (JS and ASP.NET MVC wrapper) and SignalR Act as a technical mentor to team members, providing guidance and support to enhance their skills and work quality. Collaborate with cross-functional teams to understand project objectives, gather requirements, and deliver solutions that meet business needs. Ensure code quality and maintainability by conducting code reviews, writing unit tests, and automating processes where possible. Stay abreast of new technology trends and best practices in software development to drive innovation within the team. Manage project timelines and deliverables, ensuring speedy delivery without compromising on quality. Demonstrate ownership and proactive behavior in addressing issues and pursuing solutions. Lead by example, fostering a culture of excellence, collaboration, and continuous improvement within the team. Added advantage skills to the team (if the role possess): Extensive expertise in .NET/.NET Core, .NET Core MVC/API, ASP.NET, ASP.NET MVC/MVC Web API, Azure functions, WebAPI, ADO.NET, WPF, WCF, WinForms, Entity Framework (Full and Core), MVC with Razor Views Requirements: Bachelor's or Master's degree in Computer Science, Information Technology, or related field. A minimum of 10 years of experience in software development, with significant hands-on expertise in ReactJS and .NET C# WebAPI. Proven experience as a technical leader with the ability to mentor and lead development teams. Strong proficiency in Kendo Grid for ReactJS, Azure Functions, and Service Bus technologies. Excellent communication skills, with the ability to articulate technical concepts to non-technical stakeholders. Demonstrated ability to deliver projects quickly, efficiently, and accurately. A proven track record of being a team player, with the ability to quickly adapt to new environments and technologies. High level of self-initiative, with a collaborative and highly proactive work style. Role Competencies: Collaborate with the team members and support the team Work with the Leadership team to meet expectations based on value delivered and date feasibility. Work closely with the Product Owner and Scrum Master to ensure the product can deliver quality and value as expected by the Leadership. Share frequent demos regarding the status and concerns/questions from the team to the leadership for better clarity What AgilityHealth provides to the role: Recognition of good work Appreciation of the good work Empowerment Learn & grow opportunity Respect for individual Healthy team and work environment Upskilling where required Mentoring when required Work-life balance (by default, no weekends and no long hours unless there are any critical production-related issues) Flexibility in case any doctor appointments or kids' school appointments or any personal, family & health related scenarios What competencies and traits are expected from the role: Teamwork Collaboration Talent expertise Ownership Self-drive Accountability Great articulation Knowledge Sharing (no knowledge hoarding) Commitment No rework and no constant delay Communication & keeping up the word Speed to delivery High-Quality delivery Organization Expectations Maintain high standards of ethics, integrity, attitude, teamwork, and discipline in attending meetings. Follow-ups should be avoided when stakeholder requests them (regardless of their role). Keep your ETA on track by promptly and diligently responding with answers. Stick to working hours, and it needs to be until 11 am CT, but occasionally, exceptions are allowed, like doctor's appointments and other personal appointments. When this occurs, communicate promptly in the ""Time Off"" Slack channel. Any other exemption that needs to be discussed with leadership for prior approval. No overtime hours unless it’s pre-approved by leadership Strictly no multiple jobs during the working hours of AgilityHealth Always try to stay on the video call Do not record anything on your mobile or computer other than zoom call recording. That too with zoom call recording needs to be having consensus No email forwarding to your personal email No customer data download to your laptop. They are not in compliance with SOC standards."
"Shopify Application Architect and Developer","$2M+
spent","Hourly: $35.00 - $100.00 Expert Est. time: 3 to 6 months, 30+ hrs/week","Yes","JavaScript, .NET Framework, Java, Google Cloud Platform, Shopify Apps","Yes","node.js","https://www.upwork.com/jobs/Shopify-Application-Architect-and-Developer_~021917674323342957799/?referrer_url_path=/nx/search/jobs/","Description: We’re seeking a skilled Shopify app developer to architect and build custom apps hosted on Google Cloud Platform (GCP). These apps will support Shopify merchants with enhanced fulfillment, tracking, and carrier integration capabilities. Must-Have Experience: Deep familiarity with Shopify’s Order API, Fulfillment API, CarrierService API, and Webhook system Proven experience building Shopify custom or public apps Backend development skills (Node.js, Python, or Go preferred) Strong GCP knowledge (Cloud Run, Pub/Sub, Firestore, etc.) Ability to build secure, scalable, multi-tenant applications Nice to Have: Experience with Narvar, AfterShip, Shippo, or logistics platforms Familiarity with Shopify app store standards Scope: Project-based with potential for ongoing work. Initial deliverables include a merchant-facing fulfillment support app and carrier data integration layer."
"Full-Stack Software Engineer (AI & Mobile Web)","$1M+
spent","Hourly Expert Est. time: 3 to 6 months, Less than 30 hrs/week","Yes","React, Python, Amazon Web Services, Artificial Intelligence","Yes","node.js","https://www.upwork.com/jobs/Full-Stack-Software-Engineer-Mobile-Web_~021916929661451538611/?referrer_url_path=/nx/search/jobs/","Project Overview: We’re developing a new mobile-focused, AI-driven platform for HVAC contractors to size, quote, and sell residential HVAC systems quickly and efficiently. We need a Full-Stack Software Engineer with experience integrating various AI frameworks (e.g., loveable, cline.bot, etc.) and building robust, scalable architectures. You’ll collaborate closely with product managers, a small engineering team and a UX designer, helping to define technical strategy and deliver a fast, intuitive experience for contractors. Responsibilities Architecture & Technical Strategy Design and implement the platform’s backend architecture, ensuring security, scalability, and reliable performance. Guide decisions on data modeling, microservices vs. monolith, and cloud infrastructure. Full-Stack Development Build front-end features for a mobile-friendly web interface, from lead capture to quote generation and eCommerce checkout. Develop backend services and APIs to integrate AI tools (e.g., loveable, cline.bot) for real-time HVAC product sizing, automated quoting, and advanced data processing. AI & Integrations Evaluate and integrate AI components, potentially including LLM-based or ML-based solutions, to automate sizing and recommendation processes. Collaborate with third-party tools and frameworks to enhance quoting accuracy and user experience. Collaboration & Coordination Work closely with product managers to translate user requirements and business objectives into technical requirements. Partner with the UX designer to ensure a seamless, responsive user interface that aligns with best practices and user feedback. Testing & Quality Assurance Implement unit and integration tests to maintain code quality and platform reliability. Participate in code reviews, performance optimizations, and ongoing refactoring. Deployment & Monitoring Set up CI/CD pipelines and monitor the production environment for performance, uptime, and security. Troubleshoot and resolve issues in a timely manner. Deliverables Fully Functional Platform Backend capable of handling high-volume quote generation and secure data exchanges. Responsive Front-End (mobile-first) integrating AI-driven recommendations and user input flows. Integration with AI Tools (loveable, cline.bot, or similar) for real-time sizing, quoting, and data handling. Stable Deployment Pipeline on a modern cloud infrastructure (e.g., AWS, Azure, or GCP). Documentation for both internal technical references and handoff to future developers. Required Skills & Experience 5+ years in full-stack or software engineering roles. Proficiency in modern web frameworks (e.g., React, Vue, or Angular) and backend technologies (Node.js, Python, or comparable). Experience with AI frameworks (loveable, cline.bot, or similar) and integrating ML/LLM-based features into production environments. Strong knowledge of databases (SQL/NoSQL) and data modeling for high-performance applications. Familiarity with mobile-friendly web development, responsive design, and cross-browser compatibility. Good grasp of DevOps best practices: CI/CD pipelines, containerization (Docker, Kubernetes), and cloud services. Excellent communication skills – able to discuss technical details with developers and strategic decisions with product managers. Nice-to-Haves Background or familiarity with HVAC or field services industries (or willingness to learn). Experience in eCommerce, especially online checkout and payment gateway integrations. Security best practices in handling sensitive customer data. Performance tuning for real-time quote generation and AI inferences. Engagement & Timeline Project Start: ASAP Initial Development: 2–3 months, with potential for ongoing support or additional phases. Hours/Week: Part-time availability (20 hrs/week) preferred, but open to discussion. We expect a close collaboration with the UX designer and our internal product team. Timelines can be adjusted based on your availability and project scope. How to Apply If you’re excited to shape a new AI-driven platform that empowers HVAC contractors, we want to hear from you! Please include: A brief intro highlighting your relevant experience and technical stack. Examples (links to repositories, live projects, or portfolio) showcasing your full-stack development and AI integration work. A short note on why you’re interested in this project and how you plan to guide architecture decisions. Your availability (start date and weekly hours). We look forward to your application and the opportunity to build a next-generation solution together!"
"Experienced Web Automation Developer Needed","$1M+
spent","Fixed price Expert Est. budget: $3,000.00","Yes","Node.js, Python, Automation, JavaScript, Selenium WebDriver","Yes","node.js","https://www.upwork.com/jobs/Experienced-Web-Automation-Developer-Needed_~021915667740981656069/?referrer_url_path=/nx/search/jobs/","We are looking for an experienced developer skilled in web automation and scraping techniques to build a sophisticated web-based automated solution. This system will automate complex interactions and secure reservations on a popular platform. Specific project details and platform specifics will be provided after initial contact. Technical Skills Required: - Expert-level proficiency in web automation/scraping technologies (e.g., Selenium, Puppeteer, Playwright) - Backend development expertise (Python or Node.js strongly preferred) - Secure management of user authentication - Front-end development skills (HTML/CSS/JavaScript to create user-friendly dashboards) - Experience overcoming CAPTCHA and bot detection challenges - Database management and secure handling of sensitive user data Project Deliverables: - A robust, web-based automated system for interaction with target platform - Automated monitoring and interaction capabilities - Real-time notifications upon successful automation tasks - User-friendly, secure dashboard for managing user interactions and outcomes Timeline: We anticipate an initial version of the system to be completed within 8-12 weeks from project initiation, including testing and iterative improvements. Requirements for Applicants: - Demonstrable experience with sophisticated web automation tasks (please share relevant work examples) - Strong, proactive communication skills and willingness to provide regular updates - Commitment to compliance with platform terms of service and ethical standards Budget: Negotiable based on the applicant's experience and portfolio of relevant projects. Future Opportunities: Successful delivery and performance on this project will likely lead to additional long-term opportunities with our other ventures. Please include in your application: - Summary of your relevant experience - Portfolio showcasing similar automation or complex booking projects - Your estimated timeline and proposed budget for a project of this scope We are excited to collaborate with a dedicated and talented professional!"
"Senior Frontend Developer – React (Remote – CET ±3) (m/f/d)","$1M+
spent","Hourly: $23.00 - $41.00 Expert Est. time: More than 6 months, 30+ hrs/week","Yes","Redux, React, AWS Amplify, JavaScript, TypeScript, Web Development","Yes","node.js","https://www.upwork.com/jobs/Senior-Frontend-Developer-React-Remote-CET_~021922375276174247516/?referrer_url_path=/nx/search/jobs/","🚀 Senior Frontend Developer – React (Remote, CET ±3) 🌍 About CENDAS: At CENDAS, we're revolutionizing the construction industry through digital innovation. Since 2021, our SaaS platform has unified every stakeholder and project phase into a single, streamlined workflow. Headquartered in Germany with a globally distributed team of 60+ professionals, we empower construction companies to ""GET WORK DONE"" faster, smarter, and with fewer headaches. Our mission is to simplify the daily chaos of construction work with powerful, intuitive software. We're not just digitizing paperwork—we're making it obsolete. This is an opportunity to be at the forefront of innovation and make a lasting impact. ---------------------------------- 🔧 What You'll Bring: ⚫React & TypeScript: 5+ years of hands-on experience building robust, scalable web applications. ⚫State Management: Practical experience using Zustand, Redux, MobX, Recoil, or similar. ⚫Offline-First Development: Delivered offline-capable PWAs or desktop apps using WatermelonDB, RxDB, AWS AppSync, PouchDB, or PowerSync. ⚫Communication Skills: Fluent written and spoken English for seamless async and real-time collaboration. Dad jokes optional but appreciated. ----------------------------------- ✨ Nice to Have: • Experience with component systems like Storybook or Design Tokens. • Comfortable with Figma handoffs and modern design-to-code collaboration. • Familiarity with Node.js and NestJS; GraphQL APIs are a plus. • Exposure to React Native or Electron for cross-platform development. Not sure you meet 100% of the requirements? If you match \~80% and are excited about this role, apply anyway—we're not building rockets (yet). 🎁 Why You'll Love Working at CENDAS: • Remote-First:Work from anywhere within CET ±3 or drop by our office in Bochum, Germany (pants optional on video calls). • Flexible Hours:Organize your workday to suit your life and energy peaks. • Competitive Compensation:We offer a salary that reflects your experience and the impact you bring to the team. • AI-Positive Culture:We embrace AI to help us focus on the fun parts of our jobs (and not rewriting the same function 12 times). • Inclusive & Collaborative Team:A diverse and welcoming environment with regular virtual get-togethers (yes, even remote teams like quizzes and memes). • Meaningful Impact:Your work will directly shape the daily experience of thousands in the construction industry. • Career Advancement:Clear growth paths and mentorship. • Scale-Up Energy, Start-Up Agility:Work in a fast-moving environment with solid long-term backing—think less chaos, more ownership. 🛠️ How We Work: • We value thoughtful communication, pragmatic problem-solving, and humble collaboration. • We ship incrementally, measure outcomes, and iterate fast. • We believe great software is built by small, empowered teams that trust each other. 🎯 Your Mission: As a Senior Frontend Developer, you'll be the driving force behind our user-facing applications: Build, improve, and own features using React + TypeScript that simplify complex workflows—and make construction workers say ""Whoa, that's smooth."" • Design scalable state management solutions. • Implement robust offline-first flows so our users can work in construction sites, basements, or bunkers. • Work with a modern stack (AWS, GitHub, Jira, Microsoft Teams, you choose your equipment setup)—the usual suspects, minus the bureaucracy. • Cultivate a peer review culture where everyone both gives and receives feedback—lead by example through collaborative code reviews, knowledge sharing, and zero ego discussions. 📅 Our Hiring Process: 1. Intro Chat (15 min):A brief and friendly call to get to know each other and answer initial questions. 2. Meet the Team (30 min):Chat with one of our developers or product owners to get a feel for our day-to-day work, tech stack, and culture. We'll also explore a few technical topics to gauge alignment. 3. Take-Home Task:A realistic and focused challenge designed to reflect the kind of work you'd actually do here. 4. Technical & Culture Interview (60 min):A deep dive into your submitted task, problem-solving approach, and how you collaborate. Bonus points if you bring good questions or great memes. 5. Final Decision:Fast, transparent feedback and, if we both feel it's a match, a job offer (confetti emojis included). We respect your time and promise to communicate clearly throughout. 📝 How to Apply: Skip the standard letter of motivation! Instead, we'd love to hear about: 1. Describe a project where you implemented offline-first functionality (or another complex technical challenge). What did you learn? 2. How would you troubleshoot and improve app performance on unstable or slow connections (besides yelling at the internet provider)? 3. In your last role: What was the project about? How large was the team? Was it remote, hybrid, or onsite? What role did you play? How long were you in this role? 4. On a scale from 1–10, how do you rate your skills in each area below and why? Include a short example of how and when you last used each: React TypeScript Zustand/Redux/State Management GraphQL Node.js NestJS AWS 5. What is your salary expectation and your earliest start date? Let's build the future of construction software—and have a little fun while we're at it. 🚧💻🎉"
"Full-Stack Developer for Multi-Platform Community Bot System","$1M+
spent","Hourly: $8.00 - $9.00 Expert Est. time: 1 to 3 months, Less than 30 hrs/week","Yes","Node.js","Yes","node.js","https://www.upwork.com/jobs/Full-Stack-Developer-for-Multi-Platform-Community-Bot-System_~021909584703489091529/?referrer_url_path=/nx/search/jobs/","Job Post: Full-Stack Developer for Multi-Platform Community Bot System **About the Project - We're seeking an experienced full-stack developer or small team to implement a sophisticated community engagement bot system across multiple platforms (Wh*ts*pp, T*l*gram, and Circle.so). - The system will serve as a digital guide for our premium wellness community, providing personalized interactions and valuable content to our members. **Project Scope - Implement a complete bot system with the following components: - Wh*ts*pp Integration (Priority 1): Develop a ChatVolt-based integration for personalized 1:1 interactions - T*l*gram Bot (Priority 2): Create a community bot with scheduled content and interactive features - Circle.so Integration (Priority 3): Build a webhook-based system for our premium community platform - Cross-Platform User Tracking: Implement unified user profiles across all platforms - Admin Dashboard: Develop a management interface for analytics and content control **Technical Requirements - Node.js backend with Express - MongoDB database - Docker containerization - Manus AI integration for natural language processing - Zapier webhook integration for Circle.so - ChatVolt integration for Wh*ts*pp Business AP **Required Skills & Experience - 3+ years of Node.js development experience - Experience with MongoDB or similar NoSQL databases - Familiarity with bot development (T*l*gram Bot API, - - Wh*sApp Business API) - Docker containerization knowledge - API integration experience - Understanding of webhook architectures - Experience with AI/NLP integration is a plus **Project Timeline & Commitment - Project Duration: 1-2 weeks for a small team, 2-3 weeks for a single developer - Availability for regular progress updates and feedback sessions - Commitment to delivering a fully functional, production-ready system **Deliverables - Complete, documented codebase - Docker configuration for easy deployment - Admin dashboard for system management - Comprehensive documentation for future maintenance - Knowledge transfer session upon completion"
