"title","clientSpent","estimatedBudget","paymentVerified","techStack","matchesInDescription","keyword","link","jobDescription"
"Full-Stack Developer (AI Avatar + Conversational Chatbot + Video Personalization)","$1M+
spent","Hourly: $7.00 - $9.00 Expert Est. time: 1 to 3 months, Less than 30 hrs/week","Yes","API","Yes","node.js","https://www.upwork.com/jobs/Full-Stack-Developer-Avatar-Conversational-Chatbot-Video-Personalization_~021912091102220226071/?referrer_url_path=/nx/search/jobs/","💼 Job Title: *Full-Stack Developer (AI Avatar + Conversational Chatbot + Video Personalization)* --- ### 🧠 About Us: We’re building the next-generation AI-powered customer experience platform — think *eSelf.ai meets your favorite wellness guide*. Our mission is to transform how people interact with brands by creating deeply personal, engaging, and intelligent video avatar systems that *talk, listen, respond, and convert*. We're looking for a highly skilled and innovative *full-stack developer or team* to build our AI avatar system from the ground up. --- ### 🚀 What You’ll Build: A fully interactive *AI video avatar platform* that: - 💬 Responds to user inputs using GPT-4 / Claude - 🧠 Displays a talking video avatar (AI-generated OR based on uploaded footage of the user) - 📹 Plays videos, sends opt-in forms, collects name/email/phone numbers - 🧾 Stores all conversation data and session behavior - 🎙️ Converts uploaded footage of the user into a talking AI avatar (optional but ideal) --- ### 🛠 Tech Skills We’re Looking For: *Frontend* - React.js (preferred) or Vue.js for dynamic UI - TailwindCSS for styling - Experience building or integrating real-time chat interfaces *Backend* - Node.js or Python (FastAPI/Django) for backend services - WebSockets / Server-Sent Events for live chat - MongoDB or PostgreSQL for session and user data *AI Integration* - OpenAI API (GPT-4 or GPT-4o) or Claude for AI chat - ElevenLabs / Google TTS for voice synthesis - Avatar generation via D-ID API, HeyGen, or custom Wav2Lip-style pipeline *Avatar Personalization (Bonus)* - Ability to process uploaded video footage to create custom avatars - Integration with voice cloning or face animation tech (e.g., SadTalker, EMO, Wav2Lip) *Other Integrations* - HubSpot / Systeme.io / Zapier for CRM and marketing automation - Firebase / Mixpanel for user analytics and behavior tracking --- ### ✅ You’re a Fit If You: - Have experience building complex, interactive web apps with AI and media - Have strong understanding of real-time communication (WebSockets, video, TTS) - Can work independently, ship fast, and communicate clearly - Are obsessed with creating smooth, intuitive user experiences - Have worked with avatar systems or multimedia AI tools before (bonus) -- ### 📦 Deliverables: - Working prototype with interactive AI video chat - Option for custom avatars from uploaded footage - Opt-in form collection and integration with CRM - Admin dashboard to view leads and session data - Smooth handoff documentation for future scaling --- ### 📍Location: Remote — must be able to work in North America or similar time zones. --- ### 💰Budget: *Negotiable*, based on experience and proposed build strategy --- ### 📝 How to Apply: Please send: - A short intro and why you’re perfect for this - Examples of past work (especially AI + video/avatar/chat experience) - Your estimated timeline and tech stack recommendation - Portfolio, GitHub, or demo links if available --- ### 💡Bonus Points For: - Prior work with D-ID, Synthesia, or Wav2Lip clones - Experience with CRM integrations and user analytics - Wellness, coaching, or personal development niche experience"
"AI Support Engineer (01_05_25TOKU)","$1M+
spent","Hourly Expert Est. time: More than 6 months, 30+ hrs/week","Yes","Next.js, JavaScript, TypeScript, AI App Development","No","node.js","https://www.upwork.com/jobs/Support-Engineer-01_05_25TOKU_~021918240104770100251/?referrer_url_path=/nx/search/jobs/","We are looking for a Senior JavaScript/TypeScript Engineer who is passionate about solving real-world coding problems using AI tools and providing hands-on technical support to users. This is a full-time, long-term contractor position (40 hours/week) with a projected duration of 2 years. This role is ideal for a personable engineer who enjoys debugging, working directly with users, and leveraging the latest AI technologies to drive innovation. You will be responsible for diagnosing and resolving complex bugs in JavaScript and TypeScript applications, educating customers during live support sessions, and helping them use our AI-driven tools effectively. Requirements: - at least 5+ years of experience in frontend or fullstack development using JavaScript and TypeScript; - strong knowledge of React.js, including functional components, hooks, and props; - familiarity with Next.js (pages, API routes); - experience with deployment platforms such as Vercel, Netlify, or Supabase; - comfortable using the command line and providing support in terminal environments; - excellent spoken and written English communication skills. - a calm, analytical approach to troubleshooting and problem solving. - a positive, proactive attitude and the ability to work independently in a fast-paced environment. Nice to Have: - familiarity with debugging and prompting AI agents (e.g., Copilot, ChatGPT, etc.); - experience with customer-facing roles, live tech support, or teaching; - background in technical writing or documentation. - experience with open-source projects or public GitHub contributions. Key Responsibilities: - prompt and guide AI agents to solve coding issues effectively; - read and debug JavaScript/TypeScript code to identify and resolve bugs; - join live video or audio calls with users to provide real-time support and troubleshooting; - educate customers on how to use AI tools and guide them through best practices; - diagnose deployment and runtime issues across common platforms (e.g., Vercel, Netlify); - provide calm, clear, and structured troubleshooting in command-line environments (bash, zsh); - adapt quickly to new tools, processes, and evolving product features; - collaborate with internal teams to improve the support experience and identify product gaps. Please Note: * english fluency is essential as you will be working directly with international customers; * this is a contractor position. No employee benefits will be included in the contract;"
"Frontend Engineer - React / NodeJS","$1M+
spent","Hourly: $25.00 - $40.00 Expert Est. time: More than 6 months, 30+ hrs/week","Yes","Node.js, Website, React, JavaScript, TypeScript, CSS, HTML","No","node.js","https://www.upwork.com/jobs/Frontend-Engineer-React-span-class-highlight-NodeJS-span_~021918897110059427896/?referrer_url_path=/nx/search/jobs/","Freelance Front‑End Engineer (Gatsby + React) — US‑Morning Overlap We’re a fast‑growing SaaS startup with BIG ambitions and a small, senior team. Our marketing site runs on Gatsby; our admin dashboard is TypeScript + React. We need one exceptional front‑end freelancer (no agencies) to own both surfaces. What you’ll do • Ship pixel‑perfect pages in Gatsby for new product launches & A/B tests. • Level‑up our React dashboard UX, component library, and design system. • Work async, but overlap 9 am–12 pm US Pacific for stand‑ups & pairing. • Proactively spot UX / performance wins and just make them happen. Must‑haves • 3+ yrs professional React (hooks, state mgmt) & modern CSS. • Gatsby build pipeline, GraphQL data layer, and SEO best practices. • Eye for clean UI + smooth motion; can match Figma precisely. • Clear, upbeat written & video communication. • Self‑starter: you propose ideas, not wait for tickets. • Solo freelancers only — we want you, not a team. What makes this exciting • Massive impact: every commit ships to thousands of daily users. • Upside: crush it and earn performance bonuses, hourly rate bumps, a weekly retainer, and early‑stage stock options. • Work with a founder who codes and values engineering craft. • Modern stack, zero legacy, rapid feedback loop. Sound like a fit? Share: 1. A Gatsby or React project you’re proud of (link + 2‑sentence story). 2. Your hourly rate & availability. 3. One front‑end detail you’d improve on any site you like (show your eye). We’ll move fast — apply now and build the next‑gen web with us!"
"GCP / PM2 / Cloud Run Expert Needed for Video Conversion & Auto-Scaling Fixes","$900K+
spent","Hourly: $25.00 - $47.00 Expert Est. time: 1 to 3 months, 30+ hrs/week","Yes","Node.js, FFmpeg, Containerization","Yes","node.js","https://www.upwork.com/jobs/GCP-PM2-Cloud-Run-Expert-Needed-for-Video-Conversion-Auto-Scaling-Fixes_~021915066215233484061/?referrer_url_path=/nx/search/jobs/","Description: We're looking for an experienced backend engineer or DevOps expert to help us troubleshoot and resolve a critical issue in our production environment. Project Overview: Our portal allows users to upload video files (specifically .MOV format), which are then converted to .MP4 via backend processes. The system is deployed using Google Cloud Platform (GCP) services including Cloud Run, and managed using PM2 for process management. The problem arises when users upload large .MOV files (300MB+), and multiple files get queued. The backend process responsible for the video conversion crashes—specifically, the PM2 namespace crashes and fails to automatically recover. We're currently restarting the process manually via sudo pm2 start 8, which is not scalable or sustainable. We need someone to: * Investigate and resolve why PM2 crashes under load * Optimize the video conversion process for better memory and CPU management * Implement auto-restart or recovery mechanisms for the PM2 process * Suggest and implement improvements in how our containers scale under heavy loads * Ensure overall system reliability and uptime * Tech Stack / Tools Involved: * Google Cloud Platform (GCP) * Cloud Run * Cloud Storage * PM2 (Process Manager) * FFmpeg (or equivalent for video conversion) * Node.js (Backend service, assuming from PM2 usage) * Docker / Containerization * Linux / Shell scripting What We're Looking For: - Proven experience with GCP and containerized environments (Cloud Run especially) - Deep understanding of PM2, process monitoring, and auto-recovery strategies - Strong knowledge of FFmpeg or video processing tools - Experience optimizing performance for file-heavy, CPU-intensive applications - Familiarity with container scaling, memory limits, and process isolation - Ability to work independently and communicate clearly Bonus Points: - Experience with setting up monitoring/logging tools (e.g., Stackdriver, Prometheus, etc.) - Experience handling large media files in production environments Project Urgency: This is a high-priority issue that needs immediate attention. Please only apply if you're available to start right away and have relevant hands-on experience. To Apply: Please briefly describe your experience with the relevant tech stack, any similar problems you’ve solved, and your availability for the next few days."
"Senior DevOps/Cloud Engineer to Set Up Staging Environment on GCP","$900K+
spent","Fixed price Expert Est. budget: $2,000.00","Yes","DevOps, Google Cloud Platform, CI/CD, Deployment Automation, CI/CD Platform","Yes","node.js","https://www.upwork.com/jobs/Senior-DevOps-Cloud-Engineer-Set-Staging-Environment-GCP_~021919021662441678904/?referrer_url_path=/nx/search/jobs/","We are looking for an experienced DevOps Engineer / Cloud Specialist to help us set up a dedicated staging environment on Google Cloud Platform (GCP). Our current live application uses MySQL, Airtable, React.js, and Node.js, but we lack a proper staging environment for testing before production releases. You will be responsible for: ✅ Creating an isolated staging environment in GCP (separate from production) ✅ Configuring MySQL (Cloud SQL) for staging with proper data synchronization/masking ✅ Setting up Airtable staging base with schema sync ✅ Deploying Node.js backend and React.js frontend with staging-specific configurations ✅ Implementing CI/CD pipelines (GitHub Actions/GitLab CI/Jenkins) for automated staging deployments ✅ Configuring networking, DNS, SSL, and access controls for staging ✅ Integrating monitoring & logging (Stackdriver, Prometheus, Sentry, etc.) ✅ Documenting the setup and training the team on staging workflows Required Skills & Experience: ✔ Proven experience setting up staging/production environments (GCP preferred, AWS/Azure acceptable) ✔ Strong knowledge of GCP services (Compute Engine, Cloud SQL, IAM, Networking) ✔ Experience with MySQL database management, replication, and data masking ✔ Familiarity with Airtable API & automation (or ability to set up a staging base) ✔ Expertise in Node.js & React.js deployment strategies ✔ CI/CD pipelines (GitHub Actions, GitLab CI, Jenkins, or similar) ✔ Infrastructure as Code (Terraform/Pulumi) – Nice to have ✔ Knowledge of security best practices (SSL, access controls, PII masking) ✔ Strong documentation & communication skills In your proposal please share the timeline in which you can achive this."
"Senior Full Stack Engineer (Next, Typescript, Postgres, GraphQL, FastAPI)","$800K+
spent","Hourly Expert Est. time: More than 6 months, 30+ hrs/week","Yes","Node.js, FastAPI","No","node.js","https://www.upwork.com/jobs/Senior-Full-Stack-Engineer-Next-Typescript-Postgres-GraphQL-FastAPI_~021925750263259837130/?referrer_url_path=/nx/search/jobs/","Please follow the quick response format below to be considered. You'll join a top-tier team as a senior engineer, where you be expected to write high quality code quickly, contribute ideas to the team, execute with autonomy, and lead good practices by example. To apply, please answer the following. No other information is required. 1. Years of experience in at least 3 of the following technologies: TypeScript Next.JS TypeScript Postgres GCP Python FastAPI 2. Describe the last application or feature you built fully by yourself from scratch. (Please share as much detail as you can. Feel free to record a loom, type a paragraph and/or share links). 3. How do you use AI day-to-day in your work? A 10-minutes video call will be required to apply and substantial overlap with US Eastern timezone will be helpful. Thank you! Looking forward to reviewing your application."
"Experienced JavaScript Developer for Browser Extension (Chrome/Firefox/Edge)","$800K+
spent","Hourly: $25.00 - $40.00 Expert Est. time: More than 6 months, 30+ hrs/week","Yes","Node.js, jQuery, JavaScript, Google Chrome Extension","No","node.js","https://www.upwork.com/jobs/Experienced-JavaScript-Developer-for-Browser-Extension-Chrome-Firefox-Edge_~021924474452710791645/?referrer_url_path=/nx/search/jobs/","We are looking to expand our existing development team with an experienced JavaScript developer to support the long-term development and maintenance of our established browser extension. This extension is an integral part of our commercial password management solution and is already actively used across Chrome, Edge, and Firefox. Responsibilities: - Continue the development and maintenance of the browser extension - Implement new features (e.g. password generator, login form detection) - Optimize performance, stability, and code quality - Test and validate functionality before each release Required Qualifications: - Strong experience in JavaScript development - Proven experience with browser extension development (Chrome/Firefox/Edge) - In-depth knowledge of browser APIs (especially Chrome Extension API and Manifest V3) - Experience with Gulp - Solid knowledge of HTML, CSS/LESS, and jQuery (legacy codebase) Nice to Have: - Familiarity with cryptographic concepts and secure extension development - Experience with Native Messaging for communication with desktop applications Project Details: - Existing, modular codebase (~58,000 lines) - Built with Gulp and structured for Chrome/Firefox compatibility - Fully localized (multi-language support via _locales/) - Clear development processes and documentation available Engagement Details: Scope: Long-term collaboration preferred Workload: Approximately 10–40 hours per week Work Model: Remote; communication in English If you're interested in working on a well-established, security-oriented browser extension and meet the qualifications listed above, we’d love to hear from you. Please include references to previous extension projects, your availability, and your hourly rate."
"Long-Term Software Engineering Role — React, PostgreSQL, AI, Microservices & Integrations","$800K+
spent","Hourly: $12.00 - $15.00 Expert Est. time: More than 6 months, 30+ hrs/week","Yes","Node.js, Web Application, AI Development, React, PostgreSQL","Yes","node.js","https://www.upwork.com/jobs/Long-Term-Software-Engineering-Role-React-PostgreSQL-Microservices-Integrations_~021924427032134413546/?referrer_url_path=/nx/search/jobs/","We are looking for a highly skilled and motivated Full Stack Developer / Software Engineer to join our fast-growing team on a long-term basis. If you're passionate about modern web technologies, software architecture, and AI-driven development, and love building scalable systems that integrate across various platforms—this role is for you. What You’ll Work On Frontend development using React.js, building clean, responsive, and user-centric web interfaces. Backend systems powered by PostgreSQL, REST APIs, and microservice-based architecture. Designing and implementing scalable software architecture for cloud-based applications. Building and integrating AI-driven features into the platform (chatbots, recommendations, predictive analytics, etc.). Creating and maintaining microservices for modular, independent, and scalable deployments. Handling third-party integrations, especially with major social media platforms (Facebook, Instagram, TikTok, LinkedIn, etc.). Collaborating with cross-functional teams including product, design, and marketing. Required Skills Strong experience in React.js (hooks, state management, component architecture). Proficient in PostgreSQL — writing complex queries, performance tuning, and schema design. Experience with AI/ML integration (OpenAI APIs, TensorFlow, or similar frameworks). Deep understanding of software architecture design patterns and scalability principles. Hands-on experience with microservices (Docker, Kubernetes, service discovery). API development and third-party integrations, especially social platforms (OAuth2, Graph APIs, Webhooks). Good understanding of CI/CD pipelines, Git workflows, and DevOps basics. Bonus Skills Experience with Node.js, TypeScript, or Python in backend services. Familiarity with server less architecture (AWS Lambda, Google Cloud Functions). Knowledge of privacy, data handling, and compliance (GDPR, HIPAA is a plus). Background in SaaS development or CRM platforms. Work Details Remote-first team must be available for some overlapping hours with EST Time Zone. About Us We are building a next-gen digital platform that blends AI with integrated marketing and operational tools. Our goal is to revolutionize how businesses engage customers, automate workflows, and gain insights—all in one seamless interface. Interested? Send us: A brief intro and why you're a great fit. Relevant portfolio or project links. GitHub/LinkedIn profile (if available). Availability (hours per week and time zone)."
"Experienced Progressive Web App Developer","$800K+
spent","Hourly: $10.00 - $20.00 Expert Est. time: More than 6 months, 30+ hrs/week","Yes","Web Application, AngularJS, JavaScript, TypeScript, Progressive Web App","No","node.js","https://www.upwork.com/jobs/Experienced-Progressive-Web-App-Developer_~021919452945334947391/?referrer_url_path=/nx/search/jobs/","We are looking for an experienced front end developer that will be responsible for the design of a variety of applications. You will need to ensure there is regular communication across a global team of developers. Be able to work in full EST, CST or PST timezones. Tasks: - Extensive work with Angular 8+, JS, JQuery, HTML, and CSS. - Build Progressive Web Apps. - Able to build and run NodeJS Apps. - Create and design webpages. - Follow wireframes to build webpages. - Review and work with back end developers. - Maintaining excellent documentation. - Ensure full communication with the teams and management Required experience of the following: - 5 years experience with Angular. - 6 years experience with JS, HTML, and CSS. - 2 years experience with NodeJS - Knowledge on Behaviour Driven Development, Test Units."